{
  "$schema": "https://json-schema.org/draft/2020-12/schema",
  "$id": "https://ai-agent-office.local/schemas/carousel-design.json",
  "title": "Spesifikasi desain carousel dari Designer",
  "description": "Designer hanya memilih template dan mengisi slot (F1.7). Tidak ada HTML, CSS, atau koordinat bebas di sini — itu disengaja (ADR-0002).",
  "type": "object",
  "required": ["createdAt", "brand", "canvas", "slides"],
  "additionalProperties": false,
  "properties": {
    "createdAt": { "type": "string", "format": "date-time" },
    "brand": {
      "type": "string",
      "const": "edukasiai",
      "description": "Kunci brand kit di divisions/<division>/brand/."
    },
    "canvas": {
      "type": "object",
      "required": ["width", "height"],
      "additionalProperties": false,
      "properties": {
        "width": { "type": "integer", "const": 1080 },
        "height": { "type": "integer", "const": 1350 }
      }
    },
    "slides": {
      "type": "array",
      "minItems": 6,
      "maxItems": 10,
      "items": { "$ref": "#/$defs/designSlide" }
    }
  },
  "$defs": {
    "designSlide": {
      "type": "object",
      "required": ["index", "template", "slots"],
      "additionalProperties": false,
      "properties": {
        "index": { "type": "integer", "minimum": 1, "maximum": 10 },
        "template": {
          "type": "string",
          "enum": ["cover", "point", "stat", "quote", "comparison", "cta"],
          "description": "Harus ada di templates.json brand kit."
        },
        "colorVariant": {
          "type": "string",
          "description": "Nama varian dari brand.json. Kosong berarti varian default."
        },
        "icon": {
          "type": "string",
          "description": "Nama ikon dari set lokal brand kit. Opsional."
        },
        "emphasis": {
          "type": "array",
          "maxItems": 3,
          "items": { "type": "string", "minLength": 2, "maxLength": 40 },
          "description": "Kata yang ditekankan. Renderer menandainya; kata harus ada di salah satu slot."
        },
        "slots": {
          "type": "object",
          "description": "Isi slot teks. Nama slot dan batas karakternya didefinisikan templates.json. Renderer menolak slot yang tidak dikenal atau melebihi batas.",
          "minProperties": 1,
          "additionalProperties": { "type": "string" }
        }
      }
    }
  }
}
